<!ELEMENT employees (employee+)>
<!ELEMENT employee (name, position, department, salary)>
<!ATTLIST employee id CDATA #REQUIRED>
<!ELEMENT name (#PCDATA)>
<!ELEMENT position (#PCDATA)>
<!ELEMENT department (#PCDATA)>
<!ELEMENT salary (#PCDATA)>
